{
  "schema_version": "1.0.0-proposed",
  "run_id": "three-harden-20261020T170655Z",
  "request_id": "legal-three-harden-20261020T170655Z",
  "event_id": "evt-identity-legal-three-harden-20261020T170655Z-dc8c4c05e79347fd9da1e82b",
  "producer": {
    "name": "identity_trust_assessor",
    "module_version": "0.2.0",
    "source": "EXTERNAL"
  },
  "observed_at": "2026-10-20T17:17:01Z",
  "status": "UNKNOWN",
  "reason": "证据不足或不可核验，失败关闭：missing or unsafe XML: security/keystore/enclaves/planner/permissions.xml",
  "subject": {
    "observed_name": "planner_node",
    "declared_enclave": "/planner"
  },
  "requested_resource": {
    "resource": "/rg/guarded_navigate",
    "operation": "SERVICE_REQUEST"
  },
  "authorization": {
    "result_status": "UNKNOWN",
    "denial_layer": "UNKNOWN"
  },
  "identity_evidence": {
    "kind": "UNKNOWN",
    "detail": "未获得可验证的权限与运行时证据"
  },
  "access_control_evidence": {
    "kind": "UNKNOWN"
  },
  "evidence_refs": [
    {
      "ref": "identity_trust/assessor.py",
      "kind": "UNKNOWN",
      "note": "权限/实验证据不可用，不能当作授权证明"
    }
  ],
  "extensions": {
    "experiment_case_id": "S2",
    "historical_only": true,
    "current_request_binding": "UNBOUND_NO_CURRENT_REQUEST_SUBJECT",
    "historical_experiment_resource": "/rg/guarded_navigate",
    "current_candidate_resource": "/rg/guarded_navigate",
    "identity_binding_note": "历史实验只覆盖该次运行中真实使用 DDS 身份的主体；request_id / declared_enclave / 业务 JSON 自报身份都不是 DDS 已认证身份",
    "current_request_identity": {
      "status": "UNKNOWN",
      "evidence_kind": "NONE",
      "binding": "UNBOUND_NO_TRUSTED_CURRENT_IDENTITY_WITNESS",
      "reason": "没有可信证据把当前请求绑定到已认证 DDS 主体：ROS 2 Jazzy 未提供获取订阅端对端主体身份的 API，且业务 JSON 自报身份不构成认证",
      "historical_only": false,
      "verifier": {
        "name": "identity_trust/current_identity.py",
        "contract": "current-identity-attestation/2",
        "version": "2.0.0"
      },
      "checks": {
        "signature": "NOT_PRESENT",
        "issuer": "NOT_EVALUATED",
        "request_binding": "NOT_CHECKED",
        "freshness": "NOT_CHECKED",
        "replay": "NOT_RESERVED"
      },
      "attestation": {},
      "producer": "NOT_IMPLEMENTED: 现有 ROS 2 DDS API 不暴露当前请求主体身份"
    },
    "historical_authorization_reuse_detected": false
  }
}